Naruto, Character's physical attributes are based off of the start of Shippuden. Info sourced from the Naruto wiki
Star Wars, Character's physical attributes are based off of their introduction. Info sourced from Wookiepedia
MCU, Character's physical attributes are based off of their introduction. Info sourced from the MCU wiki
Halo, Character's physical attributes are based off of their introduction. Info sourced from the Halo wiki
Pokemon, A Pokemon's primary type is used. Info sourced from pokemondb.net.
Harry Potter, For those who did not go to Hogwarts House will be None. Info sourced from Harry Potter wiki.