Year, 1937-1942, 1989-1999, 2000-2009, 2010+																										
Species	Human, Dwarf, Spirit, Puppet, Insect, Fairy, Animal, Mermaid, Sea Creature, Enchanted Being, Demigod, God, Satyr, Demon, Alien, Cyborg, Snowman, Robot, Dragon											
Alignment, Good, Evil, Neutral																								
Gender, Male, Female, Neutral																											
Debut,Snow White and the Seven Dwarfs,Pinocchio,Dumbo,Bambi,The Little Mermaid,Beauty and the Beast,Aladdin,The Lion King,Pocahontas,The Hunchback of Notre Dame,Hercules,Mulan,Tarzan,Dinosaur,Atlantis: The Lost Empire,Lilo & Stitch,Treasure Planet,Brother Bear,The Emperor's New Groove,Tangled,The Princess and the Frog,Brave,Wreck-It Ralph,Frozen,Big Hero 6,Zootopia,Moana,Raya and the Last Dragon,Encanto,Wish
Name,First letter A-H,First letter I-Q,First letter R-Z																											
